image_path,caption
/content/drive/MyDrive/Multimodal-SSL-Hybrid/flickr30k_images/5687835083.jpg,A bald guy by a microphone is holding his pencil up and leading people playing music .
/content/drive/MyDrive/Multimodal-SSL-Hybrid/flickr30k_images/218610963.jpg,A woman is attempting to care for two children at once .
/content/drive/MyDrive/Multimodal-SSL-Hybrid/flickr30k_images/227701311.jpg,A man in a black hat is sitting on a stool in front of a lime green door with a speaker on his right side .
/content/drive/MyDrive/Multimodal-SSL-Hybrid/flickr30k_images/69152837.jpg,"Two children , a boy and a girl , are running along a beach with tire tracks in the sand ."
/content/drive/MyDrive/Multimodal-SSL-Hybrid/flickr30k_images/3564157681.jpg,A man stands by as a dog leaps to grab a Frisbee while people sitting on a wall watch .
/content/drive/MyDrive/Multimodal-SSL-Hybrid/flickr30k_images/4273698621.jpg,"A man in a green t-shirt , and a green hat operates outdoor equipment while wearing a green bandanna over his nose and mouth ."
/content/drive/MyDrive/Multimodal-SSL-Hybrid/flickr30k_images/4636392873.jpg,A man dressed in a tweed coat with vest and pocket-watch stands with his hands above his ahead before a group of children sitting on the floor with shelves of books in the background .
/content/drive/MyDrive/Multimodal-SSL-Hybrid/flickr30k_images/2690702549.jpg,Four boys stand together with their arms bended to show their strength .
/content/drive/MyDrive/Multimodal-SSL-Hybrid/flickr30k_images/3070609314.jpg,A young man dressed in a red polo shirt and khaki pants squats on the ground near a pole .
/content/drive/MyDrive/Multimodal-SSL-Hybrid/flickr30k_images/565605894.jpg,A young girl reaches for playground rings with determination in her eyes .
/content/drive/MyDrive/Multimodal-SSL-Hybrid/flickr30k_images/3582465732.jpg,A young lady is wearing bright pink sunglasses and sitting on a small trampoline .
/content/drive/MyDrive/Multimodal-SSL-Hybrid/flickr30k_images/4590415190.jpg,A gymnast wearing a blue outfit grabs onto the parallel bars and does a handstand .
/content/drive/MyDrive/Multimodal-SSL-Hybrid/flickr30k_images/7760220072.jpg,A motocross racer in a green and black jumpsuit rides his dirt bike down the dirt road .
/content/drive/MyDrive/Multimodal-SSL-Hybrid/flickr30k_images/3317073508.jpg,Six soccer players on field with player in red uniform in the air and ball airborne .
/content/drive/MyDrive/Multimodal-SSL-Hybrid/flickr30k_images/34453650.jpg,A homeless man sleeping under a green blanket along side a cement wall .
/content/drive/MyDrive/Multimodal-SSL-Hybrid/flickr30k_images/1464813188.jpg,Two young girls are sitting in the living room playing video games and drinking canned soft drinks .
/content/drive/MyDrive/Multimodal-SSL-Hybrid/flickr30k_images/4864287206.jpg,"Two young boys , one holding an unicef bag , the other an unicef bucket ."
/content/drive/MyDrive/Multimodal-SSL-Hybrid/flickr30k_images/2879966085.jpg,"Young male with glasses , blond-hair and beard , holding a black shovel over a campfire and a barbecue pit , filled with red meat ."
/content/drive/MyDrive/Multimodal-SSL-Hybrid/flickr30k_images/4938457809.jpg,Middle-aged man in jeans and dark blue t-shirt carrying a black item and walking across a lawn .
/content/drive/MyDrive/Multimodal-SSL-Hybrid/flickr30k_images/6889307511.jpg,A man with a white beard and hair pulled back in a ponytail is wearing a karate outfit with a yellow belt and standing in a ready pose .
/content/drive/MyDrive/Multimodal-SSL-Hybrid/flickr30k_images/47333488.jpg,Four members of a band are performing on stage .
/content/drive/MyDrive/Multimodal-SSL-Hybrid/flickr30k_images/2678193588.jpg,Several children are sitting at a table as a little boy wearing a red shirt with a white design looks towards the camera .
/content/drive/MyDrive/Multimodal-SSL-Hybrid/flickr30k_images/5468293105.jpg,A man with a black shirt and black protective gear punching another man with a yellow shirt and red protective gear while they practice boxing .
/content/drive/MyDrive/Multimodal-SSL-Hybrid/flickr30k_images/2426781076.jpg,A boy wearing all black is sliding down a blow up yellow slide .
/content/drive/MyDrive/Multimodal-SSL-Hybrid/flickr30k_images/952352291.jpg,"A blond man with a ponytail and straw hat is walking on a busy road in a city , passing by some plants for sale ."
/content/drive/MyDrive/Multimodal-SSL-Hybrid/flickr30k_images/2537697530.jpg,Workers in hard hats and orange vests laying cement tiles over the floor .
/content/drive/MyDrive/Multimodal-SSL-Hybrid/flickr30k_images/3212456649.jpg,A brown dog jumps over the dead plants in a snowy field .
/content/drive/MyDrive/Multimodal-SSL-Hybrid/flickr30k_images/3309042087.jpg,A snowboarder is making a jump over a hillside with deep powder located in the woods .
/content/drive/MyDrive/Multimodal-SSL-Hybrid/flickr30k_images/4912108775.jpg,A man in a black shirt with a white ring in his right hand reaching for something on the edge of a window .
/content/drive/MyDrive/Multimodal-SSL-Hybrid/flickr30k_images/113678030.jpg,A snowboarder sits on a slope with skiers and boarders nearby .
/content/drive/MyDrive/Multimodal-SSL-Hybrid/flickr30k_images/4931360505.jpg,"Brunette female wearing yellow bikini top , has large tattoo inked across her lower back , and a blue towel draped across her right shoulder ."
/content/drive/MyDrive/Multimodal-SSL-Hybrid/flickr30k_images/2983837415.jpg,A group of Asian villagers all wearing conical hats are unloading large bags and sacks off of a truck .
/content/drive/MyDrive/Multimodal-SSL-Hybrid/flickr30k_images/1570065565.jpg,"Two chefs in white are working in the kitchen , while a woman sits at a nearby counter ."
/content/drive/MyDrive/Multimodal-SSL-Hybrid/flickr30k_images/3980305243.jpg,A young man watching a woman perform on stage in a cream costume with black boots and feather headdress .
/content/drive/MyDrive/Multimodal-SSL-Hybrid/flickr30k_images/1386973587.jpg,A man in a brown shirt and tan shorts is taking a picture of a napkin as he sits on blanket .
/content/drive/MyDrive/Multimodal-SSL-Hybrid/flickr30k_images/3347500603.jpg,Two men are carrying red bags on the street beside a white metal fence .
/content/drive/MyDrive/Multimodal-SSL-Hybrid/flickr30k_images/500190886.jpg,A mother tries to console her smallest child after a visit to a medical facility for his immunizations .
/content/drive/MyDrive/Multimodal-SSL-Hybrid/flickr30k_images/3525841965.jpg,Two young girls stand in the dirt road and smile at the camera .
/content/drive/MyDrive/Multimodal-SSL-Hybrid/flickr30k_images/4672453085.jpg,Protesters holding flags and signs are protesting in the streets of New York as an NYPD police officer keeps the peace .
/content/drive/MyDrive/Multimodal-SSL-Hybrid/flickr30k_images/2483666380.jpg,A woman in a blue and white striped shirt holding a green comb .
/content/drive/MyDrive/Multimodal-SSL-Hybrid/flickr30k_images/4896419115.jpg,A man is walking through a colorful part of town on the way home with a sack of groceries .
/content/drive/MyDrive/Multimodal-SSL-Hybrid/flickr30k_images/4608742964.jpg,Two gentlemen in top hats and a well-dressed lady in a straw hat ride in a green and red carriage pulled by four white horses .
/content/drive/MyDrive/Multimodal-SSL-Hybrid/flickr30k_images/3595412126.jpg,Two girls in pink coats drink from soda bottles and lean on a tree .
/content/drive/MyDrive/Multimodal-SSL-Hybrid/flickr30k_images/3433341061.jpg,A Jewish family joins for dinner on a sunday to worship .
/content/drive/MyDrive/Multimodal-SSL-Hybrid/flickr30k_images/241346105.jpg,An American footballer in a red strip is running down the side of the field with the ball .
/content/drive/MyDrive/Multimodal-SSL-Hybrid/flickr30k_images/3856958902.jpg,Two female nurses are standing by a pushcart in a hospital hallway .
/content/drive/MyDrive/Multimodal-SSL-Hybrid/flickr30k_images/281297361.jpg,An elderly woman in a tan coat and scarf tied around her head is standing outside .
/content/drive/MyDrive/Multimodal-SSL-Hybrid/flickr30k_images/3183195653.jpg,The brightly dressed middle eastern women are conversing in the market .
/content/drive/MyDrive/Multimodal-SSL-Hybrid/flickr30k_images/947664583.jpg,A little girl with inflatable armbands is jumping into the pool
/content/drive/MyDrive/Multimodal-SSL-Hybrid/flickr30k_images/2868776402.jpg,A young girl wearing pink is riding her bike in front of a store on a boardwalk .
/content/drive/MyDrive/Multimodal-SSL-Hybrid/flickr30k_images/191003284.jpg,A man helps a young girl balance on a bicycle that is too big for her .
/content/drive/MyDrive/Multimodal-SSL-Hybrid/flickr30k_images/83457315.jpg,"A man , wearing a blue sweater and gray coat , lifts the top off one of a row of cooking platters outside a shop ."
/content/drive/MyDrive/Multimodal-SSL-Hybrid/flickr30k_images/3335035034.jpg,Two men playing guitars are standing on a stage with lots of equipment surrounding them .
/content/drive/MyDrive/Multimodal-SSL-Hybrid/flickr30k_images/181157221.jpg,Two dogs try to reach each other as their human companions pull them in opposite directions by their leashes .
/content/drive/MyDrive/Multimodal-SSL-Hybrid/flickr30k_images/4369134678.jpg,A man wearing all white is using an orange chainsaw to cut down a thick tree next to his house .
/content/drive/MyDrive/Multimodal-SSL-Hybrid/flickr30k_images/4524828504.jpg,Man sitting on the floor wearing a harness attached to some lines doing construction work .
/content/drive/MyDrive/Multimodal-SSL-Hybrid/flickr30k_images/264009676.jpg,Two men in the grocery store looking at orange juice and speaking to each other .
/content/drive/MyDrive/Multimodal-SSL-Hybrid/flickr30k_images/3018086343.jpg,"There is a man in an orange shirt sitting down with a puppy and ladies in white in the background , facing the opposite direction ."
/content/drive/MyDrive/Multimodal-SSL-Hybrid/flickr30k_images/4943704965.jpg,"A young girl with long brown hair , wearing a white blouse , blue skirt with purple stockings and red boots , stands along a concrete barrier , filled with blue , green and pink graffiti paint , watching a group of men play soccer ."
/content/drive/MyDrive/Multimodal-SSL-Hybrid/flickr30k_images/3508637029.jpg,A softball player in sunglasses tries to avoid a mishap with another player .
/content/drive/MyDrive/Multimodal-SSL-Hybrid/flickr30k_images/7581393544.jpg,"Two women in pink saris , a woman in a black sari , a man with a yellow scarf and a man with a blue jacket buy vegetables from a street vendor , who is wearing a pink shirt ."
/content/drive/MyDrive/Multimodal-SSL-Hybrid/flickr30k_images/154295293.jpg,A group of people are standing and conversing inside of a building .
/content/drive/MyDrive/Multimodal-SSL-Hybrid/flickr30k_images/5840187633.jpg,A female toddler gets on the treadmill as she looks at the camera .
/content/drive/MyDrive/Multimodal-SSL-Hybrid/flickr30k_images/2390134107.jpg,Several men in matching yellow shirts are standing by some sort of frame .
/content/drive/MyDrive/Multimodal-SSL-Hybrid/flickr30k_images/4095536845.jpg,There are two policemen walking down a semi-crowded street with batons along side a man wearing a blue and white plaid shirt .
/content/drive/MyDrive/Multimodal-SSL-Hybrid/flickr30k_images/4032977916.jpg,A woman in a white and beige-striped sweater answers telephones in an office .
/content/drive/MyDrive/Multimodal-SSL-Hybrid/flickr30k_images/2421823977.jpg,Four men are standing in front of a wall that is full of graffiti as another man is poised above looking down on them .
/content/drive/MyDrive/Multimodal-SSL-Hybrid/flickr30k_images/4690951134.jpg,A group of people are standing around waiting for a train .
/content/drive/MyDrive/Multimodal-SSL-Hybrid/flickr30k_images/4483576244.jpg,A man wearing a cowboy hat and no shirt has his back turned and is being embraced by two women who are both smiling .
/content/drive/MyDrive/Multimodal-SSL-Hybrid/flickr30k_images/4707103760.jpg,"Man with red , white and blue flag with one star holds it waving in the wind in the middle of a street while a crowd is seen in the background and water is sprayed ."
/content/drive/MyDrive/Multimodal-SSL-Hybrid/flickr30k_images/3288912340.jpg,A shirtless boy sits on top of an overturned boat beside a body of water .
/content/drive/MyDrive/Multimodal-SSL-Hybrid/flickr30k_images/4648447880.jpg,George Stephanopoulos and Cynthia Maralis at a Good Morning America Summer Concert Series on-stage .
/content/drive/MyDrive/Multimodal-SSL-Hybrid/flickr30k_images/144844274.jpg,"A girl , wearing white shorts and a green top , is swinging on a rope swing and there is a large red building in the background ."
/content/drive/MyDrive/Multimodal-SSL-Hybrid/flickr30k_images/3559429170.jpg,"A man without a shirt , wearing a helmet , jumping a bike in the air near water ."
/content/drive/MyDrive/Multimodal-SSL-Hybrid/flickr30k_images/2251992614.jpg,A man walks with his shirt off and rolled up pants in a busy city street .
/content/drive/MyDrive/Multimodal-SSL-Hybrid/flickr30k_images/4305146644.jpg,A group of construction workers are attempting to pull a cover onto a framework .
/content/drive/MyDrive/Multimodal-SSL-Hybrid/flickr30k_images/2865376471.jpg,Two dogs one white and another tan are on leash with two women at an open doorway .
/content/drive/MyDrive/Multimodal-SSL-Hybrid/flickr30k_images/3793774643.jpg,Man giving a presentation at the Australian War Memorial on an Apple MacBook .
/content/drive/MyDrive/Multimodal-SSL-Hybrid/flickr30k_images/4449702228.jpg,A few people sitting down and relaxing on a sunny day on steps with grass in-between each step .
/content/drive/MyDrive/Multimodal-SSL-Hybrid/flickr30k_images/4937982786.jpg,"An old woman wearing a pink , floral dress is walking while holding a magazine under her arm ."
/content/drive/MyDrive/Multimodal-SSL-Hybrid/flickr30k_images/3249891874.jpg,There are four girls with shorts on walking together .
/content/drive/MyDrive/Multimodal-SSL-Hybrid/flickr30k_images/3468635980.jpg,A man in a gray jacket and black pants standing inside of a bus .
/content/drive/MyDrive/Multimodal-SSL-Hybrid/flickr30k_images/128128618.jpg,Two men are sitting on a park bench serenading people walking through the park at night .
/content/drive/MyDrive/Multimodal-SSL-Hybrid/flickr30k_images/2173677067.jpg,"A small girl standing on one leg in the grass , with another child in the background ."
/content/drive/MyDrive/Multimodal-SSL-Hybrid/flickr30k_images/4653328697.jpg,A man dressed in tan sweater and pants looks down at a wood cross that is bordered by a barbed wire fence .
/content/drive/MyDrive/Multimodal-SSL-Hybrid/flickr30k_images/2974798723.jpg,"A man is doing a skateboarding trick , known as the ollie , over a staircase ."
/content/drive/MyDrive/Multimodal-SSL-Hybrid/flickr30k_images/5914789066.jpg,Baseball player making an attempt to hit the ball while the catcher is ready to catch the ball the ref is looking to make a call on the ball .
/content/drive/MyDrive/Multimodal-SSL-Hybrid/flickr30k_images/3590557969.jpg,A man wearing very little clothing is doing a jump on a red bicycle .
/content/drive/MyDrive/Multimodal-SSL-Hybrid/flickr30k_images/3580941967.jpg,A person with long hair stares out of the window on the top level of a double decker bus .
/content/drive/MyDrive/Multimodal-SSL-Hybrid/flickr30k_images/6962373672.jpg,A male windsurfer surfing on some blue waves with his yellow surfboard and red and white sail it looks as though he is about to fall into the water because he is suspended in the air sideways .
/content/drive/MyDrive/Multimodal-SSL-Hybrid/flickr30k_images/4693475539.jpg,A man wearing black and talking on a cellphone walks past a public train stop which features a men 's fragrance ad on its side .
/content/drive/MyDrive/Multimodal-SSL-Hybrid/flickr30k_images/7024548153.jpg,"A young women wearing a green shirt and hat is sitting down , using a mehndi cone to paint a flower design on the back of one of her hands ."
/content/drive/MyDrive/Multimodal-SSL-Hybrid/flickr30k_images/3405011838.jpg,many people are sitting at wooden tables overlooking snow covered mountains .
/content/drive/MyDrive/Multimodal-SSL-Hybrid/flickr30k_images/481054596.jpg,The man in the red shirt is taking a photo of the couple that is hugging on the sidewalk .
/content/drive/MyDrive/Multimodal-SSL-Hybrid/flickr30k_images/6012829906.jpg,"A young , white man in blond matted hair simulates surfing in the evening for a crowd of people ."
/content/drive/MyDrive/Multimodal-SSL-Hybrid/flickr30k_images/2563766793.jpg,A man in a Chinese hat walks down the street with a basket of toys .
/content/drive/MyDrive/Multimodal-SSL-Hybrid/flickr30k_images/5995751546.jpg,Two men are sitting on a pile of fishing nets on a dock next to an elaborately designed fishing vessel .
/content/drive/MyDrive/Multimodal-SSL-Hybrid/flickr30k_images/4652284040.jpg,A man in a blue and white hat and a red and white shirt sets up a small table with glassware before him and a shadow on a streetlight is seen on the gray wall behind him .
/content/drive/MyDrive/Multimodal-SSL-Hybrid/flickr30k_images/2557922709.jpg,A girl in glasses is looking over two American flags near a wooded area .
/content/drive/MyDrive/Multimodal-SSL-Hybrid/flickr30k_images/56012911.jpg,"The background is filled with the exotic roofs and textures built in the "" pagoda "" style of many nations near India as pedestrians pass and a woman in a red dress holding a small child stops to look at the hundreds of pigeons gathered about ."
/content/drive/MyDrive/Multimodal-SSL-Hybrid/flickr30k_images/3858228351.jpg,A person is falling from the sky with a parachute with mountains and a body of water in the background .
/content/drive/MyDrive/Multimodal-SSL-Hybrid/flickr30k_images/491495182.jpg,A group of people are inside a building and one man with a black bandanna is sitting looking at the camera .
/content/drive/MyDrive/Multimodal-SSL-Hybrid/flickr30k_images/7333560206.jpg,Two bulldozers are being transported on a truck with trees in the background .
/content/drive/MyDrive/Multimodal-SSL-Hybrid/flickr30k_images/3165123595.jpg,Four men in red vests with crosses on them ski on a mountain .
/content/drive/MyDrive/Multimodal-SSL-Hybrid/flickr30k_images/1075881101.jpg,A child covered in foam is climbing on a black inflatable ramp .
/content/drive/MyDrive/Multimodal-SSL-Hybrid/flickr30k_images/4717658442.jpg,Walking down a street with other people some young girls wear unusual costumes reminiscent of the sea and hold signs .
/content/drive/MyDrive/Multimodal-SSL-Hybrid/flickr30k_images/4548933629.jpg,"Two men and a woman standing in front of a Teva Neuroscience outdoor booth , with a man behind the table ."
/content/drive/MyDrive/Multimodal-SSL-Hybrid/flickr30k_images/204150602.jpg,"A man in long pants does a handstand on a large , circular object in the evening ."
/content/drive/MyDrive/Multimodal-SSL-Hybrid/flickr30k_images/47871819.jpg,The girl in the white strip is falling down as the girl in the blue strip challenges for the soccer ball .
/content/drive/MyDrive/Multimodal-SSL-Hybrid/flickr30k_images/2453990033.jpg,"A young girl dressed in a red hoodie , red pants and red sneakers in a midair front split pose ."
/content/drive/MyDrive/Multimodal-SSL-Hybrid/flickr30k_images/6222964233.jpg,"A man performs a kick flip off of a rail at a large skate park , with others in the background ."
/content/drive/MyDrive/Multimodal-SSL-Hybrid/flickr30k_images/4915259885.jpg,Two boys in black shirts sit facing away from the camera next to a person in a brown leather jacket .
/content/drive/MyDrive/Multimodal-SSL-Hybrid/flickr30k_images/4152957260.jpg,High above the ground two people cross a large yellow bridge on foot .
/content/drive/MyDrive/Multimodal-SSL-Hybrid/flickr30k_images/6956922556.jpg,Two brown-haired girls blow kisses at the camera while standing on a tree lined path .
/content/drive/MyDrive/Multimodal-SSL-Hybrid/flickr30k_images/6907176643.jpg,"Two guys in baseball caps are trying to catch a frisbee , one has caught it ."
/content/drive/MyDrive/Multimodal-SSL-Hybrid/flickr30k_images/3716283232.jpg,Three men dressed in suits and ties clasps their raised hands while standing in front of corporate logos .
/content/drive/MyDrive/Multimodal-SSL-Hybrid/flickr30k_images/5944489107.jpg,A jockey is riding a camel draped with an American flag down a track .
/content/drive/MyDrive/Multimodal-SSL-Hybrid/flickr30k_images/3211316116.jpg,A surfer in a yellow shirt is riding a wave that is reflecting sunlight .
/content/drive/MyDrive/Multimodal-SSL-Hybrid/flickr30k_images/4705341010.jpg,A group watches a man as he gives a presentation .
/content/drive/MyDrive/Multimodal-SSL-Hybrid/flickr30k_images/3143991972.jpg,"Near seats , woman has spread out green blanket to sit on floor with baby ."
/content/drive/MyDrive/Multimodal-SSL-Hybrid/flickr30k_images/2057160636.jpg,The person is in a conoe and holding a paddle in front of some mountains .
/content/drive/MyDrive/Multimodal-SSL-Hybrid/flickr30k_images/3749668646.jpg,A group of people are putting on an elaborate theatrical performance .
/content/drive/MyDrive/Multimodal-SSL-Hybrid/flickr30k_images/6813684611.jpg,"Three people are playing music ; two with violins and one with a guitar , and at least two of them are singing into microphones ."
/content/drive/MyDrive/Multimodal-SSL-Hybrid/flickr30k_images/3288174272.jpg,"Women of African origin are colecting water at common water tap , near wire fence ."
/content/drive/MyDrive/Multimodal-SSL-Hybrid/flickr30k_images/6221289833.jpg,A boy wearing a white and green athletic uniform is about to kick a soccer ball .
/content/drive/MyDrive/Multimodal-SSL-Hybrid/flickr30k_images/2412716991.jpg,Several people are standing in a crowded urban environment .
/content/drive/MyDrive/Multimodal-SSL-Hybrid/flickr30k_images/5391728144.jpg,"Six people tend to various chores and responsibilities on board a sailing ship while it 's docked in a harbor ; while three of the men appear to be dressed in normal clothes like jeans and plain or striped shirts , the other two men and the woman are dressed as pirate characters ."
/content/drive/MyDrive/Multimodal-SSL-Hybrid/flickr30k_images/2251152321.jpg,"A child standing on a chair to shove his face into a fire by a candle , his negligent father watches on in bemusement ."
/content/drive/MyDrive/Multimodal-SSL-Hybrid/flickr30k_images/2632133026.jpg,"An old man with a cowboy hat , cowboy boots , and blue jeans stands next to a cabin and looks off into the distance as the sun sets in the background ."
/content/drive/MyDrive/Multimodal-SSL-Hybrid/flickr30k_images/3627679667.jpg,A person in a black wetsuit is surfing a small wave on a beige surfboard .
/content/drive/MyDrive/Multimodal-SSL-Hybrid/flickr30k_images/3019923691.jpg,A black dog wearing an orange collar is entangled with fishing wire .
/content/drive/MyDrive/Multimodal-SSL-Hybrid/flickr30k_images/4508983604.jpg,A large group of people are gathered outside of a brick building lit with spotlights .
/content/drive/MyDrive/Multimodal-SSL-Hybrid/flickr30k_images/2647394564.jpg,A child is leaping from one bed to another in the same room .
/content/drive/MyDrive/Multimodal-SSL-Hybrid/flickr30k_images/3216829599.jpg,A person crouched in the middle of a large wave in the ocean .
/content/drive/MyDrive/Multimodal-SSL-Hybrid/flickr30k_images/5790434381.jpg,Four construction workers in safety equipment are working on the wall of a building with the help of a red crane attached to a large truck .
/content/drive/MyDrive/Multimodal-SSL-Hybrid/flickr30k_images/5925545440.jpg,A young woman is painting the wall of a room with bright orange-red paint .
/content/drive/MyDrive/Multimodal-SSL-Hybrid/flickr30k_images/3002670780.jpg,"Three chefs in a kitchen , the left most chef is flipping something in a frying pan , the middle chef is the only one without a hat , his hands are blurred from movement , the right most chef is wearing glasses and arranging food artfully on a plate ."
/content/drive/MyDrive/Multimodal-SSL-Hybrid/flickr30k_images/5501805647.jpg,"A person , wearing a trench coat and hat , is sitting on a bench outside reading a newspaper ."
/content/drive/MyDrive/Multimodal-SSL-Hybrid/flickr30k_images/7019270491.jpg,A brunette woman wearing sunglasses is juggling two lemons in the air as she smiles .
/content/drive/MyDrive/Multimodal-SSL-Hybrid/flickr30k_images/3513265399.jpg,A baseball player slides home in a non professional baseball game in an HDR photograph .
/content/drive/MyDrive/Multimodal-SSL-Hybrid/flickr30k_images/3046861840.jpg,"A man in a red jacket , sitting on some rocks overlooking the mountains in front of him ."
/content/drive/MyDrive/Multimodal-SSL-Hybrid/flickr30k_images/3524436870.jpg,A dark brown dog is looking at bubbles while walking on green grass .
/content/drive/MyDrive/Multimodal-SSL-Hybrid/flickr30k_images/2664103423.jpg,The man crouched down as he held onto the parachute that was caught in the breeze .
/content/drive/MyDrive/Multimodal-SSL-Hybrid/flickr30k_images/3113437367.jpg,A middle eastern looking dude is stuck in a glass cage filled with pretzels .
/content/drive/MyDrive/Multimodal-SSL-Hybrid/flickr30k_images/3227620119.jpg,A young woman in a yellow shirt runs across a grassy field in competition .
/content/drive/MyDrive/Multimodal-SSL-Hybrid/flickr30k_images/451597318.jpg,Brown dog leaping up with orange disc in mouth with blue and yellow toy boat in background .
/content/drive/MyDrive/Multimodal-SSL-Hybrid/flickr30k_images/2757803246.jpg,A little blond boy is running around in the grass behind a row of benches
/content/drive/MyDrive/Multimodal-SSL-Hybrid/flickr30k_images/188370695.jpg,"At some sort of large gathering , a group of men who appear to be chefs stand in a circle sharing some kind of food ."
